评语,种类
老师对待教学认真负责，语言生动，条理清晰，举例充分恰当，对待学生严格要求，能够鼓励学生踊跃发言，使课堂气氛比较积极热烈。,优点
老师授课的方式非常适合我们，他根据本课程知识结构的特点，重点突出，层次分明。理论和实际相结合，通过例题使知识更条理化。,优点
绝大多数教案设计完整，教学重点、难点突出、设置得当，紧紧围绕新课标，能突出对学科素养的高度关注。板书设计具有高度的归纳与概括性，并能展示知识内在结构。,优点
教案节次足，大部分教师已经备完整本教材，教学环节齐全，重点难点把握到位，能够指导教学。,优点
注重选择恰当的教学方法，注重在灵活多样的教学方法中培养学生的合作意识和创新精神。,优点
老师讲课十分认真投入，内容纲举目分，条理性很强，而且特别善于举例，让同学理论联系实际，学习起来十分轻松，而且印象深刻，收到良好的效果。,优点
老师为人和蔼，课堂能与同学们互动，营造温馨的课堂气氛。,优点
老师年轻漂亮，善于调动同学们的积极性，课堂气氛很活跃。授课认真仔细，声音甜美，和蔼可亲。态度认真负责，极有耐心，是我们心中可亲的老师。,优点
老师讲课突出重点，内容详细，条理清晰，细致入微。对深奥的物理现象解释的通俗易懂，并且见解独到深入，学识渊博,优点
对工作认真负责，一丝不苟，对学生因材施教，使我们对信号系统这门课产生了浓厚的兴趣,优点
老师授课的方式非常适合我们，他根据本课程知识结构的特点，重点突出，层次分明。理论和实际相结合，通过例题使知识更条理化。,优点
课堂中，他循循善诱，强调独立思考，引导学生进行启发是思维。,优点
老师上课诙谐有趣，他善于用凝练的语言将复杂难于理解的过程公式清晰、明确的表达出来。讲课内容紧凑、丰富，并附有大量例题和练习题，十分有利于同学们在较短时间内掌握课堂内容。,优点
教学内容丰富有效，教学过程中尊重学生，有时还有些洋幽默，很受同学欢迎。,优点
李老师采用多媒体辅助教学，制作的电子教案详略得当，重点与难点区分的非常清楚，使我们依靠它能及时跟上老师的思维。,优点
李老师教学经验丰富，很复杂的问题他能用很通俗易懂的语言讲清楚，使我们的信号系统这门课学地相当轻松，学习成绩得到了较大的提高。,优点
课堂内容充实，简单明了，使学生能够轻轻松松掌握知识。,优点
老师担任课程教师，认真负责，有很强的敬业精神，和蔼可亲，幽默风趣，课堂气氛十分活跃，讲课有特色，很受学生欢迎。,优点
教案中较少体现多媒体教学手段，注重培养学生的探究精神和创新能力的力度不够。,缺点
教案后的教学反思不够认真、不够详细，没能对本堂课的得与失作出记录与小结，从中也可以看出我们对课后反思还不够重视。,缺点
授课速度有点快，来不及记录,缺点
课堂上细节讲解不够。,缺点
对学生的带动性不够。,缺点
整个课堂的气氛不是很活跃，学生的兴奋度还不高，上课有点放不开。,缺点
在课堂教学中，老师没有设置一个适合学生学习的情景，导致这个教学过程不连贯。,缺点
教师示范少，学生没机会展示。,缺点
教师没有及时帮助学生解决练习中出现的安全问题。,缺点
在这节课的内容安排上，课中的内容最好减少一个活动内容，否则教学时间有点紧。,缺点
